33,https://www.mentalhealth.org.uk/about-us/news/signs-hope-british-teenagers-mental-health-loneliness-and-anxiety-remain-high-new-findings-long-term,Signs of hope for British teenagers' mental health but loneliness and anxiety remain high: New findings from long-term study,"This content mentions loneliness or isolation, anxiety and depression, which some people may find triggering. The easing of lockdown seems to have helped many British teenagers’ mental health. Still, loneliness and anxiety remain extremely common, according to new research by the Mental Health Foundation and Swansea University. The study, launched in the summer of 2020, is one of the few that repeatedly asks younger teenagers about their experiences of the pandemic. The latest results were gathered from 2349 British teenagers (aged 13 to 19) in an online survey by YouGov between 24 May to 15 June 2021. “We’re seeing hopeful signs of young people’s resilience in our latest data but also evidence that many teenagers have a mental health ‘hangover’from the pandemic,” saidCatherine Seymour, Head of Research at the Mental Health Foundation. “We gathered our new results in late May and June when young people were back in school, restrictions were lifting, and vaccines were being rolled out. “We found that fewer teenagers said their mental health is ‘poor’, compared to when we last surveyed them in March, while pessimism about the future has become less common and fewer teenagers are reporting experiences associated with depression,” she added. The proportion of teenagers who say their mental health is ‘poor’ has fallen from 18% of those surveyed in March to 14% of those questioned in the new survey. Pessimism is also becoming less common, although it is widespread. When the study previously asked teenagers about the future for people their age, 65% said it would be ‘a lot’ or ‘a little’ worse. This has fallen to 57% of teenagers questioned in the latest survey. Further results suggest that fewer teenagers are having experiences associated withdepression, including problems withsleeping,appetite, concentrating and feeling bad about themselves. Catherine Seymour added: “While all this is encouraging, our results also show that loneliness is widespread, despite the unlocking, while huge numbers remainanxiousabout the pandemic.Lonelinessis especially significant because it suggests alack of nourishing relationshipsthat help teenagers to cope with difficult times. Loneliness leaves them more vulnerable.” Loneliness appears to be as common as it was in March 2021. According to the latest results, 64% of teenagers surveyed said they ‘sometimes’ or ‘often’ have no one to talk to, and 66% said they ‘sometimes’ or ‘often’ feel alone. Anxiety also remains common. 43% of those surveyed said they are ‘very’ or ‘fairly’ worried about another lockdown, 45% are ‘very’ or ‘fairly’ worried about their family or friends being ill with COVID-19 and 32% ‘very’ or ‘fairly’ worried about someone close to them dying. Almost one-in-four (39%) said they are ‘very’ or ‘fairly’ worried about the pandemic affecting their mental health. Anxiety and other distress are especially common among some groups, including females, teenagers whose parents are classed as ‘C2DE’, full-time students, people with long-term health conditions and disabilities and 18- to 19-year-olds. Professor Ann John of Swansea Universitysaid:“The big influences on teenagers’ mental health are living in economic adversity and having pre-existing mental and physical health conditions and disabilities. And, specifically, that time in late teens of rapid social and emotional changes and life transitions. Teenagers in these groups appear to be less likely to bounce back from the effects of the pandemic. “Looking forward, we really need to ensure that these inequalities are not widened and that the pandemic does not have a knock-on, long-lasting effects on their futures. To do this, we need policies and practical initiatives that span government departments and go beyond mental health services–although these are vital and chronically underfunded–to include accessible and accessed employment, training and education opportunities, financial safety nets for families and affordable housing.” The study is supported by MQ Mental Health Research, which recently led to calls for the Government to do more to support the mental health of children and young people during the pandemic. Lea Milligan, the charity’s Chief Executive, said: “The historic underfunding of mental health services, resources and research for young people has been brought into sharp focus by the pandemic. Now that we are, I hope, starting to emerge from the shadow of COVID-19, we can focus on levelling up and supporting the most vulnerable to recover through a holistic approach to mental health. “The improvements to wellbeing that young people are self-reporting through this survey are a welcome first step to recovery. If we are to ensure the future health of the COVID-19 generation truly, then much more needs to be done.” All figures, unless otherwise stated, are from YouGov Plc. The total sample size was 2349 teenagers aged 13 to 19 years. Fieldwork was undertaken between 24 May – 15 June 2021. The survey was carried out online. The figures have been weighted and represent all British Teenagers aged 13 to 19 years. With funding from MQ, the Mental Health Foundation and Swansea University are leading this longitudinal study of adolescents (people aged 13 to 19) across Great Britain. It is part of a wider study of how the pandemic affects people’s mental health in the UK by the Mental Health Foundation and the University of Cambridge, Swansea University, Strathclyde University, Queen’s University Belfast and De Montfort University Leicester. The study uses repeated cross-sectional surveys via YouGov. Survey participants are different on each sampling occasion but taken from the same pool and always representative of the British population. The survey covers approximately 20 topics, including the pandemic’s impact on mental health and the key drivers of risk. Ethical approval has been obtained from Swansea University’s Research Ethics Committee. MQ Mental Health Researchis the biggest charity that exclusively funds research into mental health conditions, their causes and treatments. The Adolescent Data Platform facilitated by MQ aims to improve the speed and effectiveness of research into young people's mental health. It brings together data from different sources and is the biggest platform of its kind. It helps to connect researchers from different fields, reduce the cost and time involved in accessing information and address the significant gap in research about young people's mental health. Our vision is for good mental health for all. We work to prevent mental health problems. We will drive change towards a mentally healthy society for all and support communities, families and individuals to lead mentally healthy lives with a particular focus on those at greatest risk. We are the home of Mental Health Awareness Weekand has developed a dedicated COVID-19 resources hub that includes advice aimed at young people. It has also published recommendations about what government policies will help people in the UK to recover from the pandemic. The charity is to invest at least £1 million in programmes targeting some of the groups who have been hardest hit by the pandemic – including people of colour, single parents and those with long-term health conditions. 26th Jun 2025
          / Research Following the publication of the first Adult Psychiatric Morbidity Survey in a decade, we share our views on the findings. 23rd Oct 2024
          / Research New research from the Mental Health Foundation and SIPHER Consortium shows up to 100,000 mental health appointments could be freed up through Universal Credit top-ups for households caring for children. This content is tagged with: Home of Mental Health Awareness Week",,,,Mental Health Foundation,no,,
34,https://www.mentalhealth.org.uk/about-us/news/worryingly-high-levels-body-image-anxiety-lgbtqia-community-revealed-new-mental-health-foundation-poll,“Worryingly high” levels of body image anxiety in the LGBTQIA+ community revealed in new Mental Health Foundation poll,"This content discusses suicide or suicidal thoughts, discrimination or discriminatory violence (such as homophobia, racism, sexism and ableism), body image or generally discusses weight, depression and anxiety. Please read with care. There are details of where to find help at the bottom of this page. Worryingly high numbers of people in the LGBTQIA+ community have experienced body-image anxiety, a new online survey from the Mental Health Foundation has revealed. Of all the groups surveyed in the UK, the lesbian, gay and bisexual community appears to be the one most likely to be affected in this way. One third (33%) of the LGBTQIA+ community said they had experiencedsuicidal thoughtsand feelings in relation to theirbody image. Nearly four in ten (39%) of people who identified as bisexual and almost a quarter (23%) of people who identified as gay or lesbian have experienced suicidal thoughts and feelings because of concerns about their body image. This compares to around one in ten (11%) of heterosexuals. Almost half (45%) of people who identified as bisexual and nearly three in ten (29%) people who identified as gay or lesbian have felt “disgusted” because of their body image over the last year. The survey was commissioned to markMental Health Awareness Weekfrom 13 to 19 May, which this year has the theme of body image. Other survey findings show that 29% of bisexuals surveyed have deliberately hurt themselves because of their body image, as have 15% of gay men and lesbians. 59% of bisexuals and 46% of gay men or lesbiansfelt “anxious”because of their body image. 66% of bisexuals havefelt “depressed”because of their body image, as have 45% of gay men and lesbians. Research has found that gay men are more likely than their heterosexual counterparts to experience a desire to be thin, and this can sometimes manifest itself in higher levels of eating disorder symptoms. Studies focused on gay and bisexual men have found a connection between higher levels of body dissatisfaction, and increased likelihood of experiencing depressive symptoms and increased sexual anxiety and poorer sexual performance. Toni Giugliano, Policy and Public Affairs Manager at the Mental Health Foundationsaid: “Millions of adults across the UK are struggling with concerns about their body image, but of all the groups surveyed, the LGBTQIA+ community is most likely to be affected. Large numbers of LGBTQIA+ people have said they have self-harmed or had suicidal thoughts and feelings or have felt anxious or depressed about their bodies. “Research has shown that sexual minority men feel under pressure to hold an appearance that is centred on looking slim and athletic. Pressures to live up to those ideals can have a negative impact on their emotional health. “We found that many people identified social media as a key influence that caused them to worry about their body image. The main picture from our survey was one in which commercial, social media and advertising pressures on body image are contributing to mental health problems for millions of people. “This social harm has been allowed to develop largely unchecked. While there have been some positive initiatives, social media companies have frequently been unwilling to take the necessary steps to protect their users from harmful content. “That is why one of our key asks is for the UK Government to make preventing the promotion of unhealthy or idealised body image images a specific part of its forthcoming regulation strategy.” The Foundation states that new codes of practice should include an expectation that social media companies must take practical steps to ensure that the content they promote does note exacerbate body image concerns. The Foundation has also published an accompanying reportBody Image: How we think and feel about our bodieswhich gives advice and tips on how people can take individual action to address this urgent problem. ENDS If you are feeling like ending your life or feel unable to keep yourself safe, please call 999 or go to A&E and ask for the contact of the nearest crisis resolution team. These are teams of mental health care professionals who work with people in severe distress. If you feel affected by the content you have read, please see ourget helppage for support. There are no specific trans figures available because the number who identified as trans for the survey were too low to give a representative sample. However, this is an area the Mental Health Foundation is keen to explore and we intend to do further research on trans people and body image. The total sample size was 4,505 adults, including 179 gay men or lesbians and 190 bisexuals. Fieldwork was between 25 to 26 March 2019. The survey was carried out online. The figures have been weighted and are representative of all UK adults (aged 18+). Since 1949, the Mental Health Foundation has been the UK’s leading charity for everyone’s mental health prevention at the heart of what we do, we aim to find and address the sources of mental health problems so that people and communities can thrive. Our mission is to help people understand, protect and sustain their mental health. Mental health problems such as depression, self-harm, alcohol and drug abuse and suicidal thoughts can affect anyone, but they’re more common among people who are LGBTIQ+. While people who identify as lesbian, gay, bisexual and transgender (LGBT) experience body image concerns in ways that are generally similar to people who identify as heterosexual, their experience and relationship with their body is likely to differ in specific ways. 11th Dec 2023
          / Survey The Mental Health Foundation in Scotland is issuing a stark warning about the mental health impacts of the ongoing cost-of-living crisis, with almost one third of Scottish adults (32%) reporting feeling anxious about their financial situation in the last month. 29th Nov 2023
          / Survey The Mental Health Foundation is issuing a stark warning about the mental health impacts of the cost-of-living crisis, as more than a third of adults in Northern Ireland felt anxious about their personal finances in the past month. This content is tagged with: Home of Mental Health Awareness Week",,,,Mental Health Foundation,no,,
35,https://www.mentalhealth.org.uk/about-us/news/research-reveals-over-half-young-scots-who-feel-lonely-also-experience-depression,Research reveals over half of young Scots who feel lonely also experience depression,"This content mentions suicide or suicidal thoughts, loneliness and isolation, depression and anxiety. Please read with care. There are details of where to find help at the bottom of this page. The Mental Health Foundation has warned thatlonelinessis creating mental health problems among tens of thousands of young people across Scotland. Our new research has found that more than half of 18 to 24-year-olds experiencedepressionwhen they feel lonely, with 42% saying it leads to anxiety. 67% say their mental health worsens as a result of feeling lonely. While loneliness among older adults is well documented, the problem among younger generations is often underreported. With 2018 being Scotland's 'Year of Young People', the Foundation is warning that too many young adults are struggling with mental health problems and that a mental health storm is imminent unless we place mental health at the heart of the school curriculum. Our new research shows that technology, includingsocial media, could be exacerbating social isolation. 82% of young people say that spending time face to face with others improves their mental health. In contrast, 30% say that technology, such as social media, is causing them to feel lonely as it has replaced face-to-face contact. The stigma of loneliness remains the greatest barrier to seeking help as 46% say they would be too embarrassed to talk about it and 52% feel they ought to cope with the problem themselves. Around 30% wouldn’tspeak to their GPor another health professional about it suggesting that tens of thousands of young people could be living with undiagnosed mental health problems. Loneliness can contribute tostress,anxiety,depression, paranoia and cognitive decline, and it is a well-known factor insuicide. It can be both a cause and effect of mental health problems. The Foundation welcomes the Scottish Government's commitment to establish a Youth Commission on mental health and welcomes its plans to publish a national strategy on tackling social isolation in the lifetime of this parliament. Isabella Goldie, Director at the Mental Health Foundation, said: ""Loneliness among younger people is hugely underreported, but our research is clear that social isolation affects the mental health of young people more than any other age group. Our children are finding life harder to navigate than previous generations, and worryingly, they are living with high levels of distress. This is something we can no longer choose to ignore. ""Relationships and social connections remain at the heart of what makes and breaks our mental health. A child's ability to communicate and form relationships is vital right from the point that they enter the education system if they are to thrive at school - and “school readiness” is one of the strongest predictors of whether a child will go on to develop mental health problems. ""We need to acknowledge the important role that both parents and teachers play in helping young people to develop good relationship-building skills and do more to support adults under stress, ensuring that they are equipped to support our young people and that their own stress doesn’t leak onto those in their charge. This is vital as parental mental health has a direct impact on young people's mental health. ""If the Scottish Government is serious about making 2018 the Year of Young People then it must place health and wellbeing at the heart of the school curriculum - not at the sidelines as it currently is. It needs to invest in school-based counselling and give teachers the training they need to create inclusive environments and explore mental health. Too many of our young people are not thriving, and unless we act now, we will face an imminent mental health storm."" The research was conducted by YouGov and based in Scotland. For out of hours urgent press enquiries, please call 07511 076 870. scotlandpress@mentalhealth.org.uk Unfortunately, we do not have the capacity to respond to student media requests but we hope the website is useful in helping with your studies. If you are feeling like ending your life or feel unable to keep yourself safe, please call 999 or go to A&E and ask for the contact of the nearest crisis resolution team. These are teams of mental health care professionals who work with people in severe distress. If you feel affected by the content you have read, please see ourget helppage for support. Help and advice on how to cope with loneliness and improve your mental health. Mental health problems affect around one in six children. They include depression, anxiety and conduct disorder (a type of behavioural problem), and are often a direct response to what is happening in their lives. 26th Jun 2025
          / Research Following the publication of the first Adult Psychiatric Morbidity Survey in a decade, we share our views on the findings. 23rd Oct 2024
          / Research New research from the Mental Health Foundation and SIPHER Consortium shows up to 100,000 mental health appointments could be freed up through Universal Credit top-ups for households caring for children. This content is tagged with: Home of Mental Health Awareness Week",,,,Mental Health Foundation,no,,
36,https://www.mentalhealth.org.uk/about-us/news/mhf-responds-edinburgh-university-findings-depression,Mental Health Foundation responds to Edinburgh University findings on depression,"This content mentions depression, which some people may find triggering. Lee Knifton, Director of Scotland and Northern Ireland, responds toEdinburgh University's findings on depression: ""We welcome new research that can help to inform our understanding of biological dimensions that contribute towards the development or perpetuation ofdepression, particularly where this can lead to creating more effective treatments and support to alleviate suffering. However, it is important that we give equal significance and resources to funding and addressing the psychological and social causes of depression, which are often rooted in inequalities, trauma and stigma. ""There's no escaping from the fact that in Scotland, people in the most deprived areas are four times more likely to report symptoms of depression than those in the least deprived areas. Our immediate environment, such as financial circumstances, family, relationships, housing and welfare, will have the biggest impact on our mental health."" For out of hours urgent press enquiries, please call 07511 076 870. %73%63otlandpress@mentalhealth.org.u%6b"" rel=""nofollow"">scotlandpress@mentalhealth.org.uk Unfortunately, we do not have the capacity to respond to student media requests but we hope the website is useful in helping with your studies. We all have times when we feel down, but depression is about more than feeling sad or fed up for a few days. Depression causes a low mood that lasts a long time and affects your daily life. Depression is a common mental disorder that causes people to experience depressed mood, loss of interest or pleasure, feelings of guilt or low self-worth, disturbed sleep or appetite, low energy, and poor concentration. 26th Jun 2025
          / Research Following the publication of the first Adult Psychiatric Morbidity Survey in a decade, we share our views on the findings. 23rd Oct 2024
          / Research New research from the Mental Health Foundation and SIPHER Consortium shows up to 100,000 mental health appointments could be freed up through Universal Credit top-ups for households caring for children. This content is tagged with: Home of Mental Health Awareness Week",,,,Mental Health Foundation,no,,
