ID,URL,Title,Description,Tags,Tone,Audience,Source,Locality (yes or no),Country,Relevance
1,https://www.mentalhealth.org.uk/explore-mental-health/blogs/i-feel-frightened-angry-world-outside-my-door-impact-brexit-anxiety,“I feel frightened of the angry world outside my door”: the impact of Brexit anxiety,"This content mentions anxiety, which some people may find triggering. Brexit: a topic that has overwhelmed, fascinated and exhausted people living in the UK more than anything else in recent memory. I’m not sure if I agree with those calling it a Marmite issue. While Brexit can certainly be divisive, it has much more important and far reaching social and economic implications than whether you love or hate a yeast extract spread. Regardless of where we stand on the issue, we know one thing for certain: it’s stressing us out. The survey we ran in March 2019 (close to the first Brexit deadline) revealed that: Our survey also showed that we share these feelingswhether we voted Leave or Remain. We are either exhausted by a mission to overturn the outcome, or demoralised by the delay in fulfilling the promise of the referendum. We have argued with our family, friends and colleagues. We have lost sleep over it. We have engaged in endless political conversations and changed two Prime Ministers over it. We also know that our children are more anxious. They are actively avoiding social activities or having nightmares because ofscary world news. Examples worldwide show us that an unstable political environment can increaseanxietylevels. Research also shows that experiences of conflict in relationships, problems with sleeping and feelings of powerlessness are all associated withhigher levels of distress and poor well-being. We asked our supporters and followers on social media how they felt about Brexit and mental health. Some told us that they are too overwhelmed by their own issues to deal with Brexit. Others have questioned why we want to talk about it when there are so many other important topics. But then others have criticised us for not talking enough about Brexit when it’s consuming the nation’s media and exhausting the nation’s patience. Both views are valid. Now, almost six months on from our last survey, we are again at a crossroads with a new Brexit deadline fast approaching in October. Many of you said you are afraid of what Brexit means for you and your circumstances and that you are struggling to cope as a result. Others were anxious of the rise in levels of polarisation, intolerance and negativity. Someone told me: “I feel frightened of the angry world outside my door”. Regardless of where we stand on Brexit, it shouldn’t be acceptable for any of us to feel like that. As with everything in mental health, we shouldn’t expect Brexit anxiety to affect everyone equally. People who are disproportionately affected include: Some solutions have emerged. We know thatBrexit is likely to impact heavily on farmersand their families. To propose what would work best for them in this time of uncertainty, we are working on research in collaboration with Public Health Wales. A lot of organisations like us are out there - working hard to help reduce the mental health impacts of Brexit. It seems like everyone has been developing their own ways to deal with the 24-hour news cycle. Some of you told me that these varied from ignoring the topic to signing petitions. And from talking to friends togetting better sleep. On the back of this, we have released newtop tips on dealing with Brexit anxiety. We are extremely grateful to our supporters for providing quotes for this guide. Staying informed may be important, but we should also try to notice our limits. Being able to engage with our communities (live or online) in a meaningful way will also be important in the coming months, as will being able to have honestconversations with our children about UK and world news. Brexit talk and anxiety are here to stay. At the Foundation, we will continue to work towards good mental health for all. But for many of us, empowering our voice through community involvement and staying close to friends may be our only possible contribution. And we shouldn’t underestimate just how important this contribution is. If you feel affected by the content you have read, please see ourget helppage for support. Political uncertainty can negatively affect to our mental health. These tips can help to minimise the impact that events have on how we feel. Millions of people in the UK have felt powerless, angry or worried over the last year because of Brexit, according to calculations from our new poll. News is everywhere. In the digital age, it is no longer possible to control the news that we are exposed to, or to shield children from upsetting information. Anxiety is a feeling of unease, worry or fear. We all feel anxious sometimes, but anxiety may be a mental health problem if your feelings are very strong or last long. 7th May 2025
      / Influencing policies Thriving communities support good mental health, but poverty, inequality, and underinvestment have eroded them. We urge government action to rebuild communities and prevent mental ill-health through systemic change. 22nd Aug 2024
      / Influencing policies In the aftermath of the wave of racist riots in the UK, we look at the mental health impacts, how we got here and what we need to do to make sure it never happens again. This content is tagged with: Home of Mental Health Awareness Week",,,,Mental Health Foundation,no,,
2,https://www.mentalhealth.org.uk/explore-mental-health/blogs/why-anxiety-theme-mental-health-awareness-week-2023,Why anxiety is the theme for Mental Health Awareness Week 2023,"This content mentions anxiety, which some people may find triggering. I was thrilled to join the Mental Health Foundation earlier this year, having worked in health policy all my life. Many of us have struggled with our mental health in recent years, and it feels like there’s never been a more important time to support and protect our mental well-being. The Mental Health Foundation’s approach – preventing mental health problems before they happen and supporting everyone to thrive – really resonates with me. And the icing on the cake is being part ofMental Health Awareness Week! I have joined in with Mental Health Awareness Week for many years and am delighted to now be part of making it happen. This year for Mental Health Awareness Week we are focusing on anxiety. We all feel anxious from time to time. Anxiety is a natural response to the uncertain world around us. For example, in the currentcost-of-living crisis, more than a third ofadults feel anxious about their financial situation. But it’s important that we recognise and respond when we feel anxious, so that our anxiety doesn’t become overwhelming. Anxietycan affect us physically and mentally. If you are feeling anxious, you might notice your heart rate increasing, headaches, loss of appetite, breathlessness or chest pain. (If you are experiencing these symptoms, you should see a healthcare professional to rule out another physical cause). Anxiety might make you feel tense or nervous, find it hard to relax, feel tearful or have problems sleeping and concentrating. Friends or family might notice you are more irritable than usual, or more withdrawn. Or perhaps you seem fine on the outside but feel panicky inside. Help is at hand. There are things that we can all do to protect our mental health and manage anxiety. What works will be different from person to person. Things that might be helpful include being active, getting out in nature, practising breathing techniques, getting support to tackle money worries or eating well. Talking to a friend, or spending time with loved ones, is often a good first step. We’ve looked at the evidence for what works to manage anxiety and brought together ourtop recommendations. Taking action to address specific causes of anxiety can also help – for example, contacting a money advisor, discussing workplace stress with your employer, or seeking support if you are experiencing bullying, harassment or discrimination. If anxiety is severely affecting your everyday life, you shouldcontact your GPwho can offer additional support and help. No one should struggle alone. Anxiety isn’t just something we can overcome on our own. So much of what may trigger anxiety is not within our control. This is why,during Mental Health Awareness Week, we’ll also be talking to politicians and decision-makers about what can be done as a nation to support good mental health. While causes of anxiety are complex, financial worries, social isolation, social pressures and discrimination can all play a part. And because of this, local and national politicians should be looking at measures such as income support to reduce financial stress, provision of good quality housing, strong legislation to prevent bullying, harassment and discrimination, and ensuring communities are equipped with the services and facilities we need to live well and help protect everyone’s mental health. I encourage everyone to get involved in Mental Health Awareness Week this year. Visit our website to find our resources, including asocial media guideto help you join in the conversation#ToHelpMyAnxiety. Look out for our blogs, films, and other content during the week and please do join in with our awareness-raising event,Wear it Green Day.We’re looking forward to hearing your stories and what’s worked for you in managing anxiety. Thank you to all our sponsors who are generously supporting this year’s campaign. If your organisation is interested in getting involved,please get in touch. Together we will drive change so that all of us can live mentally healthier lives. Find out how you can get involved this year and explore all the available resources. If you feel affected by the content you have read, please see ourget helppage for support. What is anxiety and what are the symptoms; what is an anxiety disorder and what causes it; getting support and ways you can look after yourself. The cost-of-living crisis is affecting us all and our mental health. Find out what you can do to protect your mental health during the cost-of-living crisis and how you can help support others. 12th May 2025
      / Mental Health Awareness Week Peer support groups can provide people living with a long-term health condition with a community that plays a vital role in improving mental health. 12th May 2025
      / Mental Health Awareness Week As part of our ‘Community’ theme for Mental Health Awareness Week, we’re exploring people’s online communities, and suggesting what we all – and the government – can do to better navigate an increasingly complex online world. This content is tagged with: Home of Mental Health Awareness Week",,,,Mental Health Foundation,no,,
3,https://www.mentalhealth.org.uk/explore-mental-health/blogs/financial-distress-and-anxiety-during-holidays,Financial distress and anxiety during the holidays,"Location:England No matter what we feel is important at this time of year, it’s hard to escape the feeling that the holidays often means spending more money than we usually would. Whether it's gifts, travel or social events, it can be tough to get through December if your finances are tight, particularly for those of us with children with their own expectations. For some of us, the challenge of balancing your finances with the holidays can be stressful or cause anxiety. This can worsen the stresses that some of us feel every day about our bills. And it can feel like everywhere we look, there’s a reminder or an expectation to spend. But it doesn’t have to feel this way – you can still enjoy the holidays without dwelling on these sorts of feelings. Budgeting is helpful all year round and can give us a real sense of control over our finances. It’s almost always the first step financial experts recommend if we’re stressed over our finances. Budgeting is especially useful at Christmas, when there might be extra costs we don’t know whether we can afford. Having a realistic idea about upcoming income and outgoings over the festive season can also help to get a perspective on our finances, and help us plan what we can afford to spend. Try writing everything down to get a true picture of where you are with things. It’ll be better than trying to remember everything, and it’s helpful to see it all organised on paper. There’ssome great advice from organisations like Citizens Adviceabout how to fill out a budget. Essentially it comes down to totting up your income, then subtracting all essential costs for the month, such as bills, debts to pay and groceries, and finally looking at what’s left over to spend on other things, such as presents. You could also try using a budgeting app to help get a better idea of your finances. There are lots of these available for free from your app provider. Just search for 'budgeting apps'. We often think of gifts as expensive things we buy from shops to give to one another. But that’s not the only way we can make our loved ones feel appreciated this Christmas. If your budget doesn’t allow for big spending, why not consider gifting someone your time or an experience you could share? For example, you might promise to walk their dog once a month, give them a ‘voucher’ for a couple of hours of babysitting, or take on the morning cup of tea making duties for your partner. Or if there’s something you know they love doing, why not try to organise something? You might give your teen a movie night at home with them, watching their favourite film together with some snacks, or arrange to have your friend around for a board game evening you host. If you’ve got a special skill – maybe you play guitar, or you know your way around a yoga mat – you can gift someone your time to help them learn. You could even spread the love – how about promising to try to tick off as many of our50 random acts of kindnessas you can alongside a loved one? Spending time with loved ones is an important part of the festive season, and it can be beneficial for our mental health too. So, you might even find these sorts of presents help you both feel better than traditional gifts. Food for special occasions can be expensive, particularly if you’re hosting for everyone. It can be a real cause of anxiety and stress just pulling everything together – but when we’re anxious about money, that worry is doubled. That doesn’t mean you have to miss out on a special time sat around a table with everyone. Firstly, just because it’s the holidays doesn’t mean you have to shop in more expensive places than you’d usually do. If you use a cheaper supermarket, they might have some great deals on holiday food. Shop around – you might find that different supermarkets have deals on different things. It can also be cheaper to buy your Christmas food early, if you have the freezer space to keep it to the day. There are also some great guides online to cooking for Christmas on a budget,like this one from BBC Good Food. Sometimes all it takes is a bit of creativity – and who knows, you might find a new favourite dish! If you’re hosting for people, ask everyone to bring a dish along. This can reduce the financial burden (as well as the stresses of cooking) you might be taking on. If you want to make it part of the celebrations, you could help your friends and family prepare their dishes in the run up to your dinner. Finally, if things are really difficult for you, and you’re struggling to afford even the essentials, the Trussell Trust are here to help. They canhelp you find your local foodbankorprovide advice via their helpline. At this time of year, you might even find your local foodbank has some Christmas items they can help you with.  It’s important to remember when you’re experiencing financial anxiety that you’re not alone in this. The past few years have been tough for lots of us, and money worries have become more common. But this also means that people are becoming more understanding of when things are a struggle for us financially – which is why it’s so important that, when we feel able to, we’re open and honest about the financial situations we’re in. For example, if you and a friend usually exchange gifts, but you don’t think you can afford it this year and are worried what they’ll think, talk to them about it. A friend wouldn’t want you to be spending money you can’t afford, and they definitely won’t want you to be worrying about them. And who knows – maybe your friend is struggling too, and taking the pressure off them as well is the best gift you can give. It can be particularly difficult to have these conversations with children. They might not understand the financial situation your household is in, or you might be worried about them becoming anxious about the family finances. There are somehelpful guides out there from organisations like StepChangeabout how to have these conversations. And if your situation is taking its toll on your mental health, remember that support is out there. Talk to someone you trust, whether that’s a friend, relative, or someone supporting you with your mental health. Your GP can provide you with more support and theSamaritansare open 24/7 365 days a year. Find tips and advice on looking after your mental health during the festive season. Whether you’re celebrating Christmas, Hanukkah, New Year, another holiday, or none, read our advice and tips for the festive holidays. Mental health and money are connected. Find out more about how debt can affect your mental health and how to find support. Bring our life-changing programmes to families in need of support, and spaces of care and comfort to every community. This content is tagged with: Home of Mental Health Awareness Week",,,,Mental Health Foundation,no,,
4,https://www.mentalhealth.org.uk/explore-mental-health/a-z-topics/anxiety,Anxiety,"This content discusses anxiety, panic attacks, loneliness or isolation, trauma and substance abuse or addiction (which may include mentions of alcohol or drug use), which some people may find triggering. It’s normal to feel anxious sometimes. It’s how we respond to feeling threatened, under pressure or stressed: for example, if we have an exam, job interview or doctor’s appointment. Anxiety isn’t necessarily a bad thing. It can spur us on, help us stay alert, make us aware of risks and motivate us to solve problems. However, anxiety can be a problem if it affects your ability to live your life. If your anxiety is ongoing, intense, hard to control or out of proportion to your situation, it can be a sign of a mental health problem. Help is available no matter how long you’ve felt anxious or severe your symptoms. There are many different types of treatment, sotalk to your GPabout all your options. Anxiety can affect both your body and mind. The effect on your mind can include: Physical feelings can include: Anxiety can also affect your behaviour. You may withdraw from friends and family, feel unable to go to work, or avoid certain places. While avoiding situations can give you short-term relief, the anxiety often returns the next time you’re in the situation. Avoiding it only reinforces the feeling of danger and never gives you a chance to find out whether your fears are true or not. Some people with anxiety may appear to be fine on the outside while still having some of the symptoms listed above. You may have developed ways of hiding your anxiety so that other people don’t notice it. If your anxiety symptoms meet certain criteria, your GP may diagnose you with an anxiety disorder. Some common anxiety disorders include: Anxiety disorders are among the most common mental health problems. Up to 1 in 20 people in the UK have a generalised anxiety disorder. Many different factors can make anxiety disorders more likely to happen. These include genetics, painfullong-term health conditions,traumatic eventssuch as childhood abuse or domestic violence, ordrugoralcoholmisuse. Your current life situation can also trigger anxiety – for example,moneyorhousingproblems, unemployment,work stress,loneliness, bullying, or difficult family or personal relationships. There are different ways to treat and manage anxiety disorders. The right treatment for you will depend on your type of anxiety disorder, how severe it is and your circumstances. The first step to getting support is usually tospeak to your GP. This might feel hard, especially if your anxiety makes it difficult to speak on the phone or leave your home. See if you can book an appointment online or ask someone to call up to book it for you. They could also come with you to your appointment for support. Or you couldrefer yourself for talking therapy(in England only) if that feels easier. Your GP will assess you during your appointment and then explain your treatment options. Your GP may offer you self-help resources such as workbooks or online CBT courses. These are often available quite quickly and may be enough to help you feel better without trying other options. NHS Inform has anonline anxiety self-help guideyou can work through. This involves working through your thoughts, feelings and behaviours with a mental health professional. Two kinds of therapy are particularly recommended for anxiety. Different medications manage both the physical and psychological symptoms of anxiety. Talk to your GP about which one might be right for you. The NHS website has more information about medication for anxiety disorders. Anxiety UK was established in 1970 and is run by and for those with anxiety, offering an extensive range of support services designed to help support those affected by anxiety disorders, anxiety and anxiety-based depression. Services available include: Helpline services - 03444 775 774, open from 9:30am to 17:30pm Mon to Friday, along with a text service 07537 416905 and ‘Ask Anxia’ chatbot service, available 24/7 for all anxiety queries atanxietyuk.org.uk. SeeHelpline servicesfor more information. Anxiety UK also offer fast access to a range of psychological therapy services, including counselling, Cognitive Behavioural Therapy (CBT), Compassion Focused Therapy (CFT), clinical hypnotherapy and Eye Movement Desensitisation and Reprocessing (EMDR) therapy, with appointments available in person, online and by telephone. SeeTherapy servicesfor more information. If you feel affected by the content you have read, please see ourget helppage for support. Adult Psychiatric Morbidity Survey 2024 Anxiety (youngminds.org.uk) Generalised anxiety disorder in adults - NHS Self-care for anxiety - Mind What are anxiety disorders? - Mind What are the signs and symptoms of an anxiety disorder? (rethink.org) Suggestions for how to deal with anxiety and manage tough feelings. This briefing looks at what our research has uncovered: the prevalence and rates of anxiety amongst different groups of people, and the current key drivers and risk factors for anxiety. It then considers the main ways of coping with anxiety and provides recommendations to governments across the UK for preventing anxiety. Home of Mental Health Awareness Week",,,,Mental Health Foundation,no,,
