18,https://www.mentalhealth.org.uk/our-work/public-engagement/mental-health-awareness-week/anxiety-report/what-causes-anxiety,What causes anxiety?,"Everyone’s experiences of anxiety are different, and the causes of anxiety can be complicated. What is clear is that the relationship between anxiety and any social and/or environmental factors is complex and bidirectional. Social and environmental factors can contribute to the development and maintenance of anxiety and affect our ability to engage effectively in social situations. These social and environmental factors can includechildhood trauma,social isolation, negative life events, stress relating to work or education, physical or mental health problems, and social and societal pressures.viGender can also play a part. Women are almost twice as likely to experience anxiety as men.vii Other studies suggest that women are more likely to experience physical and mental abuse than men, and abuse has been linked to the development of anxiety disorders.viii Individuals who experience social isolation or loneliness often have a reduced quantity or quality of social contacts compared to those who report positive social relationships. Social isolation can lead to difficulty initiating social interactions with others, often leading to feelings of rejection and insecurity. Similarly, loneliness can lead to negative self-evaluation and feelings of inadequacy, further heightening an anxiety response.ixWhile anyone can experience loneliness, certain risk factors increase our chances of severe and lasting loneliness that can affect our mental health and sometimes increase our levels of anxiety. These include:x Childhood trauma such as physical, emotional, or sexual abuse, or neglect, can cause long-lasting effects on a person’s mental health. Experiencing childhood trauma can predispose people to developing anxiety. This can be due to changes in brain development affecting our fight or flight response, memory, and emotion regulation. Childhood trauma can also lead to negative beliefs about oneself or the world, making it more difficult to manage stressful situations and increasing the likelihood of developing anxiety. Negative life events can also contribute to anxiety. These are events that cause a significant emotional impact and disrupt our sense of security or well-being. Examples of negative life events that can, for some people, lead to anxiety include: Societal pressures can contribute to feelings of stress or anxiety, as people feel the need to meet cultural or societal expectations, standards, or norms.xiiiFor example, the idealisation of a ‘perfect’ body can lead tobody dissatisfactionand anxiety about physical appearance.xivThe pressure to be successful, achieve high grades, or excel in your career can also lead to anxiety about performance and fear of failure. Gender and expectationscan lead to feelings of anxiety or depression, particularly for those who don’t hold specific gender roles. In addition,those who identify as LGBTQ+are around twice as likely to report symptoms of poor mental health (i.e. anxiety, depression) than heterosexual adults.xvAlthough LGBTQ+ people represent only a small proportion of the total youth population, they are at increased risk of experiencing hostile environments at home and in wider society and are also subject to direct and indirect discrimination, harassment, and inequality, with detrimental consequences for their mental health.xvi Societal pressures can also be gendered.Society has different expectations of men and of women as to how they express their emotions. Men are often socialised to suppress their emotions and hide their vulnerability. This can make it more difficult for men to recognise and seek help for anxiety, leading to a higher prevalence of undiagnosed or untreated anxiety among men. Financial status.Society’s expectation to achieve significant milestones and acquire certain goods or services may lead to feelings of inadequacy or anxiety about financial status. Many different factors can lead to unequal access to mental health resources and support. Some common barriers include waiting times, transport, education and literacy, language or cultural barriers, stigma and discrimination. When people are unable to access the right support at the right time, this can cause anxiety to worsen. Tammie speaks of thepressure of being a studentcontributing to feelings of anxiety: “The pressure to succeed and be great and not disappoint others is very prominent. Especially when the schools you have attended have fostered an extremely competitive environment. Any thought of falling short is very anxiety-inducing. “Also, I know that for a lot of people, when they started university, their feeling of social anxiety increased greatly. It was a very new and overwhelming environment.” Tammie also spoke about the effect racism can have on mental health: “Being a Black British young person has brought on many intense feelings of anxiety. There have been environments throughout my life that have been less than welcoming, and it becomes such an intense thought when I anticipate entering those environments again.“ The relationship between socio-economic status and anxiety is complex, and influenced by a variety of individual, familial, and environmental factors. However, the evidence is clear that experiencing material deprivation and financial strain increases a person’s risk of having a mental health problem such as anxiety. Specifically, poverty, unemployment, and low education levels can all increase the risk of someone developing anxiety. People experiencing financial stress and being unable to afford essentials including food, heat, and mortgage/rent due to rising inflation report higher levels of anxiety.xvii Deprivation is about more than a lack of money.It can include a lack of access to resources such as adequate housing and exposure to negative stressors, such as violence, abuse and crime, or a lack of public green space. A growing body of evidence suggests the relationship between deprivation and mental health is not just about the absolute lack of resources for individuals.xviii In our research, we asked those that had been anxious in the past two weeks what was the cause of their anxiety. The most commonly reported cause of anxiety was being able to afford to pay bills, reported by 32% of respondents. The top eleven causes of their anxiety are detailed below: We found that some specific groups of respondents were more likely than others to be anxious about paying bills: Thecost-of-living crisishas undoubtedly led to increased levels of material deprivation and financial strain in the UK population, which is putting people’s mental health at risk. Our research provides new evidence of the extent to which financial strain is negatively affecting people’s mental health, specifically their experience of anxiety. Worryingly, some of the behaviours that are protective of mental health (for example, getting enough sleep and maintaining connections with family and friends) are the very behaviours that people may be reducing to cope with the increased cost-of-living. Previous: Who has anxiety in the UK?|Next: What does anxiety feel like? Download the full report (PDF) vi - Marmot, M. Fair society, healthy lives : the Marmot Review : strategic review of health inequalities in England post-2010. (2010) ISBN 9780956487001vii - Remes, O et al. A systematic review of reviews on the prevalence of anxiety disorders in adult populations. Brain and Behavior; 6 June 2016; DOI: 10.1002/brb3.497viii - Kinderman P, Schwannauer M, Pontin E, Tai S (2013) Psychological Processes Mediate the Impact of Familial Risk, Social Circumstances and Life Events on Mental Health. PLoS ONE 8(10): e76564.ix - National Academies of Sciences, Engineering, and Medicine. 2020. Social Isolation and Loneliness in Older Adults: Opportunities for the Health Care System. Washington, DC: The National Academies Press.https://doi.org/10.17226/25663.x -https://www.mentalhealth.org.uk/our-work/research/loneliness-and-mental…xi - Dijkstra-Kersten, Sandra & Biesheuvel-Leliefeld, Karolien & Van der Wouden, Johannes C & Penninx, B.W. & Van Marwijk, Harm. (2015). Associations of financial strain and income with depressive and anxiety disorders. Journal of epidemiology and community health. 69. 10.1136/jech-2014-205088.xii - Dejonckheere, E., et al. (2022). Perceiving societal pressure to be happy is linked to poor well-being, especially in happy nations. Scientific reports, 12(1), 1514.https://doi.org/10.1038/s41598-021-04262-zxiii - Harper B., Tiggemann M. The effect of thin ideal media images on women’s self-objectification, mood, and body image. Sex Roles. 2008;58:649–657. doi: 10.1007/s11199-007-9379-x.xiv - Dittmar H., Howard S. Thin-ideal internalization and social comparison tendency as moderators of media models’ impact on women’s body-focused anxiety. J. Soc. Clin. Psychol. 2004;23:768–791. doi: 10.1521/jscp.23.6.768.54799xv - Semlyen, J., King, M., Varney, J. et al. Sexual orientation and symptoms of common mental disorder or low wellbeing: combined meta-analysis of 12 UK population health surveys. BMC Psychiatry 16, 67 (2016).https://doi.org/10.1186/s12888-016-0767-zxvi - Hudson-Sharp, N. & Metcalf, H., 2016. Inequality among lesbian, gay bisexual and transgender groups in the UK: a review of evidence. National Institute of Economic and Social Research 1, 1–134.xvii - Mental Health Foundation (2023). Mental Health and the Cost-of-Living Crisis: Another pandemic in the making? Glasgow: The Mental Health Foundationxviii - Pickett KE, James OW, Wilkinson RG. Income inequality and the prevalence of mental illness: a preliminary international analysis. J Epidemiol Community Health. 2006 Jul;60(7):646-7. doi: 10.1136/jech.2006.046631. PMID: 16790839; PMCID: PMC2652881 Home of Mental Health Awareness Week",,,,Mental Health Foundation,no,,
19,https://www.mentalhealth.org.uk/our-work/public-engagement/mental-health-awareness-week/anxiety-report/who-has-anxiety-uk,Who has anxiety in the UK?,"In March 2023, the Mental Health Foundation worked with Opinium to conduct an online survey of 6000 UK adults aged 18+ to look at anxiety in the UK population, its causes, and popular coping mechanisms.1 What we found was that nearly three-quarters of the population (73%) had felt anxious at least sometimes in the previous two weeks, with 20% anxious most or all of the time. These levels of anxiety were highest amongst 18 to 34-year-olds,single parents, carers,people identifying as LGBTQ+andthose from Black and minority ethnic communities. For those who had felt anxious in the previous two weeks, more than a third (34%) stated it had interfered with their day-to-day life. Nearly half the young people (18 to 24-year-olds) in the research (45%) and students (48%) indicated that anxiety had affected their day-to-day life to a great or moderate extent. Figures were also high for both single parents (47%) and carers (41%). Our research also discovered that for just over a quarter (26%) of those suffering from anxiety, it had an even more profound effect on their life by stopping them doing what they needed to do most or all of the time. This was more apparent in some groups than others. Again, single parents (41%) and those with a long term condition (38%) experienced this the most. There are several factors that may explain the higher prevalence of anxiety among younger people compared to other groups. Increased academic or job stress and pressures could be impacting on their mental health. In ourThriving Learners studyamongst college students, those experiencing food insecurity were also experiencing high levels of depression and low levels of well-being.vIn addition,social media may add to their stressas they compare their experiences to those of others, feel pressure to present a perfect image online, and/or be a victim of cyberbullying. Anxiety can be particularly pronounced during adolescence and young adulthood. Changes at this time can be both new and stressful and may trigger feelings of uncertainty and fear, which can contribute to anxiety. Jazmine is a 21-year-old university student. She describes how feelings of anxiety can be hard to articulate and identify. “I have felt anxiety all my life but never knew what it actually was. I experienced social anxiety in school when I was afraid to talk and eat in front of others.I thought there was something wrong with me until I researched [it] and realised it is something most people experience. “As a bisexual, mixed-race woman with a disability, I feel like I’m a minority in society and many groups/forces are against people like me. It’s worrying to think that racism and homophobia still exist. “Social issues that have personally heightened feelings of anxiety for me are poverty, including worrying about where and how to gain an income.” Previous: What is anxiety?|Next: What causes anxiety? Download the full report (PDF) 1 - This data was collected by Opinium Research. The research sample was 6,000 UK adults and the data was weighted to be nationally representative. The survey took place between the 24 March and 3 April 2023.v - Maguire, C., Cameron, J., Cherman, V & Solomon, S. (2022). College Thriving Learners, The Mental Health Foundation Home of Mental Health Awareness Week",,,,Mental Health Foundation,no,,
20,https://www.mentalhealth.org.uk/our-work/public-engagement/mental-health-awareness-week/anxiety-report/what-anxiety,What is anxiety?,"Anxiety is a common emotional state characterised by feelings of unease, such as worry or fear, that can range from mild to severe. Most people feel anxious from time to time. In many cases, this can be helpful in providing motivation or keeping us safe from harm. However, when anxiety becomes excessive, it can interfere with our daily lives and lead to distress, avoidance, and even physical symptoms such as heart palpitations, stomach upsets or shortness of breath.iv NOTE: If you are experiencing physical symptoms, it is important to speak to a healthcare professional urgently as they could also be caused by another serious health condition that requires immediate treatment. Anxiety can arise in response to various life events or circumstances, such as work stress,financial worries, or relationship problems in your family, at work, with friends or your life partner. In some cases, anxiety can become a constant feeling, and persist even when there is no apparent stressor or threat. Anxiety is a natural human response to stress or perceived danger. It’s a feeling of unease, worry, or apprehension that can be caused by anything from a big event or major change to something as simple as a work presentation or meeting new people. In fact, anxiety is part of the body’s natural ‘fight or flight’ response that helps us react quickly to potential threats. It is important to note that feeling anxiety is not the same as having an anxiety disorder, which is a diagnosable mental health condition characterised by persistent and intense feelings of anxiety that are out of proportion to the situation or event that triggered them. Rather, anxiety is a common and natural emotion. When it becomes persistent or overwhelming and interferes with daily life, it can turn into a problematic condition, that may be diagnosed as an anxiety disorder. However, there are ways to manage it and reduce its impact. This could involve using effective coping strategies and support, or changes to our circumstances or environment. Some of these changes require action at local and national government level to address some of the root causes of anxiety. Anxiety disorders are a group of mental health diagnoses characterised by excessive, persistent, and irrational fear or worry about everyday situations or events. These conditions are prevalent in the UK, with an estimated one in six adults (16%) likely to have some form of anxiety.ii There are several types ofanxiety disorders. Here are some examples: Symptoms of anxiety disorders can vary from person to person and may include a combination of physical, emotional, and behavioural symptoms. In the UK, anxiety disorders are often treated with a combination of therapy and medication.iii Anxiety disorders are common and treatable mental health conditions that can significantly affect an individual’s quality of life. If you are experiencing anxiety that is becoming disabling, seeking professional help is important in order to receive an accurate diagnosis and effective treatment. Previous: Introduction|Next: Who has anxiety in the UK? Download the full report (PDF) ii-https://www.ons.gov.uk/peoplepopulationandcommunity/healthandsocialcare/mentalhealth/adhocs/13844depressionoranxietyinadultsgreatbritain22septemberto3october2021iii -https://www.nhs.uk/mental-health/feelings-symptoms-behaviours/feelings-and-symptoms/anxiety-fear-panic/iv -https://www.nhs.uk/every-mind-matters/mental-health-issues/anxiety/#what-is-anxiety Home of Mental Health Awareness Week",,,,Mental Health Foundation,no,,
21,https://www.mentalhealth.org.uk/our-work/public-engagement/mental-health-awareness-week/stories-about-anxiety,Stories about anxiety,"Anxiety is a normal emotion for us all to experience on occasion. There are lots of things that can lead to feelings of anxiety or worry. Anxiety is one of the most common mental health problems we can face. It can be caused by big life events or pressures at work or school, such as losing a job or worrying about upcoming exams. Home of Mental Health Awareness Week",,,,Mental Health Foundation,no,,
22,https://www.mentalhealth.org.uk/our-work/public-engagement/mental-health-awareness-week/anxiety-report/what-does-anxiety-feel-like,What does anxiety feel like?,"Anxiety can cause many different symptoms. It can affect how a person feels physically and mentally and how they behave. It’s not always easy to recognise when anxiety is the reason behind feeling or acting differently, but it is useful to be aware of the symptoms. Anxiety can affect everyone differently. Anxiety can have a significant impact on how a person interacts with the world around them. For example, anxiety can lead to social withdrawal, decreased productivity, and reduced quality of life. In some cases, it can cause avoidance behaviours that prevent individuals from pursuing education, work, or social opportunities, or from accessing essential resources such as health or social care or other forms of support.xix It can make it difficult to maintain interpersonal relationships, to conduct everyday activities independently and to work, and it can impact on the relationship we have with our environment. People with anxiety are more likely to miss days from work and are less productive. Young people with anxiety are also less likely to enter school and complete their education – translating into fewer life chances.xx Anxiety can cause vicious circles where the impact of anxiety can affect people in a way that exacerbates the causes of anxiety. In our survey, 29% of people identified work as a source of anxiety; the diagram shows how this might cause anxiety to escalate. A similar cycle can be illustrated by financial strain. Worries about money can have an impact on your mental health, making you more anxious. And anxiety can affect how you manage your money. Anxiety can have a significant impact on people’s social life and may create its own vicious circle. People experiencing anxiety may avoid social situations that they perceive as threatening or uncomfortable. This can lead to isolation and decreased social interaction. Anxiety can also impair an individual’s ability to communicate effectively in social situations, resulting in feelings of discomfort, self-consciousness, and embarrassment, which can further exacerbate social anxiety. This may combine with negative self-image, which can damage self-confidence and self-esteem in social situations. All of which can lead to reduced social support, as people become less likely to reach out to others for help or support. Anxiety can have a significant impact on relationships with others in several ways. It can interfere with effective communication, causing misunderstandings and disagreements with partners, family members, or friends. Anxiety can make it challenging for us to express ourselves clearly or make it difficult to listen to and understand other people. Anxiety can lead to trust issues, leading to doubt and suspicion of partners, friends, or family members. It can create a vicious cycle in which people assume their loved one is dishonest, leading to a decrease in trust and ultimately affecting the whole relationship. It can also affect an individual’s ability to establish and maintain intimacy with their partner or friends. Anxiety can lead to a fear of intimacy, distancing from others, and avoidance of emotional closeness. An individual suffering from anxiety may try to avoid conflict, leading to pent-up frustrations and ultimately a more significantly damaged relationship. Conversely, however, anxiety can also lead to higher levels of conflict in relationships as it can make people more defensive or quick to be hurt by small things. Anxiety can have an impact on physical health. One of the most common is bydisrupting sleep. Anxiety can make it difficult for people to fall asleep, stay asleep, or get restful sleep, which can lead to a wide range of negative health consequences. Poor sleep has been linked to an increased risk of obesity, diabetes, cardiovascular disease, and other chronic health conditions.xxi Research has also found a more direct link between anxiety and increased risk of cardiovascular disease. Anxiety can cause the release of stress hormones, which can increase blood pressure and heart rate, leading to chronic stress on the cardiovascular system. Anxiety can lead to unhealthy behaviours such as smoking, overeating, and sedentary lifestyles, all of which can contribute to the development of cardiovascular disease.xxii In addition, anxiety can have adverse effects on the immune system.xxiiiAnxiety has been shown to activate the body’s stress response, which can lead to a release of stress hormones such as cortisol. When cortisol levels are elevated for extended periods of time, it can weaken the immune system, making individuals more susceptible to infections, illnesses, and other health problems. When people feel anxious, they anticipate and worry about something ‘bad’ happening, such as something harmful to themselves or those they care about. What is anticipated as ‘bad’ or harmful will be different for different people and will depend on a range of factors including what experiences they have had in their lives. So, for people who have experienced a lot of shame (being judged, criticised, excluded, ignored, rejected) their anxiety may focus on their fear of further shaming experiences. As well as this ‘anxiety about shame’, anxiety can itself be shamed through being dismissed, ridiculed, laughed at, deemed ‘weak’ - including in a gendered way - or ignored. For people experiencing anxiety, the perception that ‘most people’ will have a negative attitude towards their condition reduces the chance they will seek support, both formally (e.g. from GPs or counselling) and informally (e.g. from family and friends). This was evidenced in our own research where we found that nearly half of those experiencing anxiety (45%) kept their anxiety secret – this was more likely in men (49%) than women (42%) and even higher amongst those from an Asian background (50%). We also found that many of those with anxiety (46%) would not tell their employer – again this is more pronounced in men (50%) than women (43%). Amongst males from a Black and minority ethnic background, this rises to 62%. Previous: What causes anxiety?|Next: Coping with anxiety Download the full report (PDF) xix - de Oliveira, C., Saka, M., Bone, L. et al. The Role of Mental Health on Workplace Productivity: A Critical Review of the Literature. Appl Health Econ Health Policy 21, 167–193 (2023)xx - Anxiety Disorders Theory, Research and Clinical Perspectives.Simpson, Helen, Blair, Neria, Yuval, Lewis-Fernandez, Roberto, and Schneier, Franklin. (editors) Cambridge University Press, 2010xxi -https://www.nichd.nih.gov/health/topics/sleep/conditioninfo/inadequate-…xxii - Batelaan NM, Seldenrijk A, Bot M, van Balkom T, Penninx BWJH. Anxiety and new onset of cardiovascular disease: critical review and meta-analysis. January 2016. doi:10.1192/bjp.bp.114.156554xxiii - Wingo AP, Gibson G. Blood gene expression profiles suggest altered immune function associated with symptoms of generalized anxiety disorder. Brain, behavior, and immunity. 2015;43:184-191. doi:10.1016/j.bbi.2014.09.016 Home of Mental Health Awareness Week",,,,Mental Health Foundation,no,,
